,subtitle
0,Saka on bench while Jesus STARTS for Gunners in huge clash
1,Ex-England ace reveals best advice ever was from McClaren while in the SHOWER
2,Watch former PL star wipe out Soccer AM staffer in challenge leaving fans concerned
3,Fans agree as Arsenal away kit for 2023-24 is leaked & compared to a banana
4,"William Hill: Get Joshua at 25/1 or Franklin at 175/1 to win via KO, TKO or DQ"
5,Ten Hag names 5 Man Utd players he wants to score more.. and Weghorst ISN'T one
6,Fulham hoping Arteta & Guardiola can save them as Silva aims to dodge huge ban
7,Arsenal outcast hints Arteta will regret letting him go amid uncertain future
8,Man Utd fans fear Thomas Tuchel will scupper latest transfer move for midfielder
9,Best casino bonuses - Get the best casino offers for UK players in April 2023
10,Get the best free bet sign up offers for April including bet £10 get £30
11,Bet £5 on football and get £20 in free bets with Ladbrokes
12,Betting tips for Arsenal vs Leeds: Premier League preview and best odds
13,Levy's odd transfer tactics - from speaking in code to offering agents only water
14,Chelsea fans troll Real Madrid amid James interest with Hazard comparison
15,Argentina World Cup winner accused of 'sexual assault on model at his birthday'
16,Potter admits Mount transfer out of his hands as Tuchel lines up Bayern swoop
17,Watford send fans to derby in HARRY POTTER bus as supporters hail club’s tactics
18,Premier League clubs spend record £318M in agents' fees with Man City on top
19,Paratici STEPS DOWN as Tottenham managing director immediately after worldwide ban
20,"Conte RIGHT to slam Spurs stars, they don't win & are bad pros says Souness"
21,Arsenal given fresh hope as they line up THIRD transfer bid for Raphinha
22,"Ten Hag says yes to Man Utd £88m Ramos transfer, but move depends on new owner"
23,Solomon is Fulham ace who was rated above Mudryk and has stunning Wag
24,Keep Russia out of all sport until Putin ends massacre in Ukraine and retreats
25,Arsenal have the cojones for title but it's not Arteta or team who impress most
26,I played for Man Utd but another striker was better - no one could touch him
27,I was a Prem cult hero for my celebrations but now I want European glory
28,Ex-Barca ace's Wag goes topless on hols and shows bum as he makes cheeky comment
29,Fans slam Chelsea's 'shabby' treatment as Tuchel reveals brutality of axe
30,Arsenal fans loving 'naughty talk' of TWO England midfielders joining
31,Man Utd 'accept Mason Greenwood may NOT return to training this season’
32,I nearly KILLED Neville at Man Utd training... Fergie had to stop the session
33,Laura Woods shows off toned stomach in two-piece as fans all say same thing
34,I banged in goals for Man Utd but Keane scolded me and made me change my look
35,Gary Neville says Ruud Van Nistelrooy was ‘the only player to try and punch me’
36,Barcelona confirm they will go all out to re-sign Lionel Messi on a free
37,Footballer has emergency op after whack in privates but can still have kids
38,Get up to £300 matched deposit at The Sun Vegas
39,100% Matched deposit bonus and up to 100 free spins with Duelz Casino
40,Best online casinos in the UK: Top 10 casino sites for 2023
41,Messi reacts to pal Otamendi's 'more than special' tattoo after World Cup win
42,Dennis Bergkamp pulled Arsenal kitman's pants down in front of stunned crowd
43,Luke Shaw 'agrees new long-term Man Utd contract' in huge boost for Erik ten Hag
44,I nearly went from League 2 to Europe... now I'm desperate to keep Forest up
45,Man Utd in Kane blow as Levy ‘made vow following transfer exit he still regrets’
46,World's sexiest lineswoman reveals 'perfect' player for OnlyFans
47,Ray Parlour explains why Arsenal can win title and where Rice needs to improve
48,Watch Bournemouth's academy side in shocking brawl… as fans blame Dennis Wise
49,I was outside Old Trafford when told I'd failed medical and transfer was off
50,Arsenal star Xhaka gives bizarre interview using cowboy and moustache filter
51,"Man Utd have signed just six world-class stars since Fergie left, says Neville"
52,How to get free bets on football - the best bookies to claim rewards and bonuses
53,Premier League's best paid revealed as bit-part Man Utd man makes top five
54,Newcastle announce shock signing of ex-Sunderland boss to join Howe's team
55,I made Man Utd debut next to Ronaldo.. just months later I'm in League Two
56,I necked 'Wes Brown Special' in Man Utd days - Fergie nearly sacked me
57,Jan Vertonghen says Prem clubs like Spurs need ex-players in key roles
58,Prem rivals in major Bellingham transfer boost as Real Madrid set £88m limit
59,Arsenal flop ‘could play for Barca or City’ as boss calls him ‘outstanding’
60,Arsenal step up Roque hunt with Arteta confident of beating Barca to Brazilian
61,Chelsea defender Reece James is 'top of Real Madrid's transfer wishlist'
62,Chelsea line up shock transfer bid to replace Ben Chilwell with Barcelona star
63,"Luke Shaw 'agrees' new contract, Qataris bid TWIST, Rashford UPDATE"
64,"Saliba injury UPDATE, Tavares 'could play' for Barcelona or Man City"
65,Fuming Chelsea 'looking to sell Aubameyang to Inter' in 'anti-Barca' transfer
66,Chelsea star Melanie Leupolz forced off with injury as blood streams down face
67,Georgina Rodriguez lets slip the weirdest place she and Ronaldo have had sex
68,Sunderland star Jack Diamond charged with rape and sex assault
69,Lewandowski branded a 'machine' as Barcelona star shows off insane physique
70,How I kept going in promotion battle after my kids were born 8 weeks early
71,Arsenal might be eight points ahead in Prem.. but it's STILL Man City's to lose
72,Footy has moved on from Souness... Rice probably won't care what he thinks
73,Tottenham seem to have given up on top four and it may convince Kane to go
74,Hollie Shearer stuns in red leather trousers as fans call her 'perfection'
75,Stunning Arsenal Wag and Twerk Queen shows off incredible dance routine
76,Romantic Ronaldo serenades Rodriguez about marriage as ex-Utd pal cheers
